{
  "artifact_type": "historical_replay_ledger",
  "schema_version": "1.0.0",
  "producer_version": "0.5.1",
  "rule_version": "narrative-lifecycle-rules-v0.1",
  "run_id": "run_20260713T035113631_508dfa",
  "generated_at": "2026-07-13T03:51:22.971Z",
  "ledger_id": "replay_ledger_run_20260713T035113631_508dfa",
  "status": "ok",
  "source_artifacts": [
    "data/replay/replay_cases.yaml",
    "outputs/runs/latest_run.json"
  ],
  "case_count": 5,
  "replay_cases": [
    {
      "case_id": "replay_ai_edge_success",
      "topic_id": "ai_edge_applications",
      "scenario_type": "success",
      "stage_path": [
        {
          "slice_id": "T0",
          "as_of": "2026-02-01",
          "evidence_ids_used": [
            "replay_ai_edge_label"
          ],
          "future_evidence_excluded": [
            "replay_ai_edge_capital_pricing",
            "replay_ai_edge_reality"
          ],
          "parent_stage": "S3",
          "branch_stages": [],
          "why_not_higher_stage": "Missing capital confirmation; Missing pricing adoption; Missing hard reality evidence.",
          "early_radar_candidate_ids": [
            "radar_replay_ai_edge_success_S3"
          ],
          "diff_change_type": "initial_snapshot",
          "diff_detected_changes": [
            "initial_snapshot"
          ]
        },
        {
          "slice_id": "T1",
          "as_of": "2026-02-15",
          "evidence_ids_used": [
            "replay_ai_edge_capital_pricing",
            "replay_ai_edge_label"
          ],
          "future_evidence_excluded": [
            "replay_ai_edge_reality"
          ],
          "parent_stage": "S5",
          "branch_stages": [],
          "why_not_higher_stage": "Missing hard reality evidence.",
          "early_radar_candidate_ids": [],
          "diff_change_type": "stage_upgrade",
          "diff_detected_changes": [
            "stage_upgrade",
            "evidence_added",
            "why_not_higher_changed"
          ]
        },
        {
          "slice_id": "T2",
          "as_of": "2026-03-15",
          "evidence_ids_used": [
            "replay_ai_edge_capital_pricing",
            "replay_ai_edge_label",
            "replay_ai_edge_reality"
          ],
          "future_evidence_excluded": [],
          "parent_stage": "S6",
          "branch_stages": [],
          "why_not_higher_stage": "S6 is not safety; monitor continuity, friction, and S7 branch outcomes.",
          "early_radar_candidate_ids": [],
          "diff_change_type": "stage_upgrade",
          "diff_detected_changes": [
            "stage_upgrade",
            "evidence_added",
            "why_not_higher_changed"
          ]
        }
      ],
      "final_stage_before_outcome": "S6",
      "outcome_status": "confirmed",
      "correct_stage": "S6",
      "outcome_summary": "Later operating evidence confirmed the parent narrative reached reality validation without using market-price movement as proof.",
      "misclassification": false,
      "lead_time_days": 73,
      "missed_change": false,
      "false_positive": false,
      "parent_branch_separation_preserved": true,
      "calibration_suggestion": "Keep E4 multi-customer replication as the required S6 confirmation point."
    },
    {
      "case_id": "replay_metaverse_failure",
      "topic_id": "consumer_metaverse",
      "scenario_type": "failure",
      "stage_path": [
        {
          "slice_id": "T0",
          "as_of": "2026-01-10",
          "evidence_ids_used": [
            "replay_meta_label"
          ],
          "future_evidence_excluded": [
            "replay_meta_capital_pricing"
          ],
          "parent_stage": "S3",
          "branch_stages": [],
          "why_not_higher_stage": "Missing capital confirmation; Missing pricing adoption; Missing hard reality evidence.",
          "early_radar_candidate_ids": [
            "radar_replay_metaverse_failure_S3"
          ],
          "diff_change_type": "initial_snapshot",
          "diff_detected_changes": [
            "initial_snapshot"
          ]
        },
        {
          "slice_id": "T1",
          "as_of": "2026-01-25",
          "evidence_ids_used": [
            "replay_meta_capital_pricing",
            "replay_meta_label"
          ],
          "future_evidence_excluded": [],
          "parent_stage": "S5",
          "branch_stages": [],
          "why_not_higher_stage": "Missing hard reality evidence.",
          "early_radar_candidate_ids": [],
          "diff_change_type": "stage_upgrade",
          "diff_detected_changes": [
            "stage_upgrade",
            "evidence_added",
            "why_not_higher_changed"
          ]
        }
      ],
      "final_stage_before_outcome": "S5",
      "outcome_status": "falsified",
      "correct_stage": "S3",
      "outcome_summary": "Later usage and customer-retention evidence weakened the narrative; the replay should treat the S5 setup as an overreach.",
      "misclassification": true,
      "lead_time_days": 50,
      "missed_change": false,
      "false_positive": true,
      "parent_branch_separation_preserved": true,
      "calibration_suggestion": "Add stricter downgrade pressure when pricing language lacks reality evidence across the validation window."
    },
    {
      "case_id": "replay_policy_s7b",
      "topic_id": "industrial_policy_cycle",
      "scenario_type": "s7b",
      "stage_path": [
        {
          "slice_id": "T0",
          "as_of": "2026-04-01",
          "evidence_ids_used": [
            "replay_policy_label_capital_pricing"
          ],
          "future_evidence_excluded": [
            "replay_policy_saturation"
          ],
          "parent_stage": "S5",
          "branch_stages": [],
          "why_not_higher_stage": "Missing hard reality evidence.",
          "early_radar_candidate_ids": [],
          "diff_change_type": "initial_snapshot",
          "diff_detected_changes": [
            "initial_snapshot"
          ]
        },
        {
          "slice_id": "T1",
          "as_of": "2026-04-20",
          "evidence_ids_used": [
            "replay_policy_label_capital_pricing",
            "replay_policy_saturation"
          ],
          "future_evidence_excluded": [],
          "parent_stage": "S7B",
          "branch_stages": [],
          "why_not_higher_stage": "S7B state evidence is present; still verify continuity and failure signals.",
          "early_radar_candidate_ids": [],
          "diff_change_type": "stage_band_change",
          "diff_detected_changes": [
            "stage_band_change",
            "evidence_added",
            "why_not_higher_changed"
          ]
        }
      ],
      "final_stage_before_outcome": "S7B",
      "outcome_status": "weakened",
      "correct_stage": "S7B",
      "outcome_summary": "Later evidence confirmed saturation and weakening rather than a new early-stage opportunity.",
      "misclassification": false,
      "lead_time_days": 30,
      "missed_change": false,
      "false_positive": false,
      "parent_branch_separation_preserved": true,
      "calibration_suggestion": "Keep S7B separate from early opportunity logic and surface it as a risk-state classification."
    },
    {
      "case_id": "replay_bci_s7c_branch",
      "topic_id": "bci",
      "scenario_type": "s7c",
      "stage_path": [
        {
          "slice_id": "T0",
          "as_of": "2026-05-01",
          "evidence_ids_used": [
            "replay_bci_parent_label_capital"
          ],
          "future_evidence_excluded": [
            "replay_bci_branch_s7c"
          ],
          "parent_stage": "S4",
          "branch_stages": [],
          "why_not_higher_stage": "Missing pricing adoption; Missing hard reality evidence.",
          "early_radar_candidate_ids": [
            "radar_replay_bci_s7c_branch_S4"
          ],
          "diff_change_type": "initial_snapshot",
          "diff_detected_changes": [
            "initial_snapshot"
          ]
        },
        {
          "slice_id": "T1",
          "as_of": "2026-05-25",
          "evidence_ids_used": [
            "replay_bci_branch_s7c",
            "replay_bci_parent_label_capital"
          ],
          "future_evidence_excluded": [],
          "parent_stage": "S4",
          "branch_stages": [
            {
              "branch_id": "bci_medical_rehab",
              "current_stage": "S7C",
              "evidence_ids": [
                "replay_bci_branch_s7c"
              ]
            }
          ],
          "why_not_higher_stage": "Missing pricing adoption; Missing hard reality evidence.",
          "early_radar_candidate_ids": [
            "radar_replay_bci_s7c_branch_S4",
            "radar_replay_bci_s7c_branch_bci_medical_rehab"
          ],
          "diff_change_type": "branch_mutation_candidate",
          "diff_detected_changes": [
            "branch_change",
            "branch_mutation_candidate"
          ]
        }
      ],
      "final_stage_before_outcome": "S4",
      "outcome_status": "confirmed",
      "correct_stage": "S4",
      "outcome_summary": "Later evidence confirmed the branch mutation while the parent narrative stayed S4.",
      "misclassification": false,
      "lead_time_days": 50,
      "missed_change": false,
      "false_positive": false,
      "parent_branch_separation_preserved": true,
      "calibration_suggestion": "Preserve parent and branch separation; never lift parent BCI to S7C from branch evidence."
    },
    {
      "case_id": "replay_industrial_iot_no_change",
      "topic_id": "industrial_iot",
      "scenario_type": "long_no_change",
      "stage_path": [
        {
          "slice_id": "T0",
          "as_of": "2026-02-01",
          "evidence_ids_used": [
            "replay_iot_label_capital"
          ],
          "future_evidence_excluded": [],
          "parent_stage": "S4",
          "branch_stages": [],
          "why_not_higher_stage": "Missing pricing adoption; Missing hard reality evidence.",